{"format":"axiom-platform-observation-v1","formatVersion":1,"scenarioId":"PLAT-SCHEMA-001","profileId":"web-reference","platformFamily":"WEB","execution":{},"capabilities":[],"terminal":{},"steps":[],"artifacts":{},"semanticCheckpoints":[],"stateCheckpoints":[],"targetBindings":[],"realization":{},"diagnostics":[]}
